{
  "meta": {
    "project_name": "Sistema Demo",
    "created_at": "2026-01-03T17:53:20.041093",
    "version": "v1",
    "srs_version": "v1"
  },
  "domain": {
    "entities": [
      {
        "name": "empresa",
        "primary_key": "id",
        "fields": [
          {
            "name": "id",
            "type": "uuid",
            "required": true,
            "unique": true,
            "indexed": true
          },
          {
            "name": "nome",
            "type": "string",
            "required": true,
            "unique": false,
            "indexed": false
          },
          {
            "name": "cnpj",
            "type": "string",
            "required": true,
            "unique": true,
            "indexed": false
          },
          {
            "name": "endereco",
            "type": "string",
            "required": false,
            "unique": false,
            "indexed": false
          }
        ]
      },
      {
        "name": "endereço",
        "primary_key": "id",
        "fields": [
          {
            "name": "id",
            "type": "uuid",
            "required": true,
            "unique": true,
            "indexed": true
          },
          {
            "name": "nome",
            "type": "string",
            "required": true,
            "unique": false,
            "indexed": false
          }
        ]
      },
      {
        "name": "cnpj",
        "primary_key": "id",
        "fields": [
          {
            "name": "id",
            "type": "uuid",
            "required": true,
            "unique": true,
            "indexed": true
          },
          {
            "name": "nome",
            "type": "string",
            "required": true,
            "unique": false,
            "indexed": false
          }
        ]
      },
      {
        "name": "nome",
        "primary_key": "id",
        "fields": [
          {
            "name": "id",
            "type": "uuid",
            "required": true,
            "unique": true,
            "indexed": true
          },
          {
            "name": "nome",
            "type": "string",
            "required": true,
            "unique": false,
            "indexed": false
          }
        ]
      }
    ],
    "relations": [],
    "workflows": [],
    "rules": []
  },
  "api_intent": {
    "resources": [
      "empresa",
      "endereço",
      "cnpj",
      "nome"
    ]
  },
  "ui": {
    "pages": [
      {
        "path": "/app/empresa/list",
        "title": "Listar Empresa",
        "components": [
          "table",
          "pagination",
          "search"
        ],
        "actions": [
          "list",
          "view",
          "delete"
        ]
      },
      {
        "path": "/app/empresa/new",
        "title": "Novo Empresa",
        "components": [
          "form"
        ],
        "actions": [
          "create"
        ]
      },
      {
        "path": "/app/empresa/:id",
        "title": "Detalhes Empresa",
        "components": [
          "form"
        ],
        "actions": [
          "view",
          "update",
          "delete"
        ]
      },
      {
        "path": "/app/endereço/list",
        "title": "Listar Endereço",
        "components": [
          "table",
          "pagination",
          "search"
        ],
        "actions": [
          "list",
          "view",
          "delete"
        ]
      },
      {
        "path": "/app/endereço/new",
        "title": "Novo Endereço",
        "components": [
          "form"
        ],
        "actions": [
          "create"
        ]
      },
      {
        "path": "/app/endereço/:id",
        "title": "Detalhes Endereço",
        "components": [
          "form"
        ],
        "actions": [
          "view",
          "update",
          "delete"
        ]
      },
      {
        "path": "/app/cnpj/list",
        "title": "Listar Cnpj",
        "components": [
          "table",
          "pagination",
          "search"
        ],
        "actions": [
          "list",
          "view",
          "delete"
        ]
      },
      {
        "path": "/app/cnpj/new",
        "title": "Novo Cnpj",
        "components": [
          "form"
        ],
        "actions": [
          "create"
        ]
      },
      {
        "path": "/app/cnpj/:id",
        "title": "Detalhes Cnpj",
        "components": [
          "form"
        ],
        "actions": [
          "view",
          "update",
          "delete"
        ]
      },
      {
        "path": "/app/nome/list",
        "title": "Listar Nome",
        "components": [
          "table",
          "pagination",
          "search"
        ],
        "actions": [
          "list",
          "view",
          "delete"
        ]
      },
      {
        "path": "/app/nome/new",
        "title": "Novo Nome",
        "components": [
          "form"
        ],
        "actions": [
          "create"
        ]
      },
      {
        "path": "/app/nome/:id",
        "title": "Detalhes Nome",
        "components": [
          "form"
        ],
        "actions": [
          "view",
          "update",
          "delete"
        ]
      }
    ]
  },
  "nfr": {
    "security": {
      "auth_required": true,
      "audit_log_required": false
    }
  }
}