{
  "meta": {
    "project_name": "Sistema Petclinic",
    "created_at": "2026-01-05T16:12:26.475401",
    "version": "v15",
    "srs_version": "v16"
  },
  "domain": {
    "entities": [
      {
        "name": "role",
        "primary_key": "id",
        "fields": [
          {
            "name": "id",
            "type": "uuid",
            "required": true,
            "unique": true,
            "indexed": true
          },
          {
            "name": "admin",
            "type": "string",
            "required": true,
            "unique": false,
            "indexed": false
          },
          {
            "name": "vet",
            "type": "string",
            "required": true,
            "unique": false,
            "indexed": false
          },
          {
            "name": "recepcionist",
            "type": "string",
            "required": true,
            "unique": false,
            "indexed": false
          }
        ]
      }
    ],
    "relations": [],
    "workflows": [],
    "rules": []
  },
  "api_intent": {
    "resources": [
      "role"
    ]
  },
  "ui": {
    "pages": [
      {
        "path": "/app/role/list",
        "title": "Listar Role",
        "components": [
          "table",
          "pagination",
          "search"
        ],
        "actions": [
          "list",
          "view",
          "delete"
        ]
      },
      {
        "path": "/app/role/new",
        "title": "Novo Role",
        "components": [
          "form"
        ],
        "actions": [
          "create"
        ]
      },
      {
        "path": "/app/role/:id",
        "title": "Detalhes Role",
        "components": [
          "form"
        ],
        "actions": [
          "view",
          "update",
          "delete"
        ]
      }
    ]
  },
  "nfr": {
    "security": {
      "auth_required": true,
      "audit_log_required": false
    }
  }
}